{
  "specVersion": "1.0",
  "eventId": "33333333-3333-4333-8333-333333333333",
  "eventType": "dispatch.decision.recorded",
  "occurredAt": "2026-08-21T14:40:00Z",
  "producer": "compute-api",
  "aggregateId": "11111111-1111-4111-8111-111111111111",
  "aggregateVersion": 1,
  "correlationId": "44444444-4444-4444-8444-444444444444",
  "causationId": "55555555-5555-4555-8555-555555555555",
  "traceId": "0123456789abcdef0123456789abcdef",
  "payload": {"strategy": "nearest", "strategyVersion": "1.0.0"}
}
